{"access":{"claim_promotion":false,"model_loaded":true,"model_output_accessed":true,"sealed_targets_accessed":false},"activation":{"hidden_size":960,"hidden_states_count":33,"output_content_retained":true,"primary_semantics":"final_transformer_block_output","primary_view":"problem_plus_transformation","surface_baseline_token_site":"sentinel","surface_baseline_view":"problem_only","token_site":"mean_transformation_span","tuple_index":32},"artifact_class":"a0r2-activation-receipt","claim_ids":[],"created_at":"2026-08-17T06:15:14Z","empirical":true,"evidence_eligible":false,"expert_validated":false,"input_hashes":{"cases_sha256":"479caee11dd62a978e8f01e9802db624b1714909264292b53067e97e10002541","corpus_manifest_sha256":"46c5cdf796f2abad709deb3066cfadd5fc6e6a30f55a737b3408e0a15b065c06","feasibility_receipt_sha256":"5ba37c8b1d74a231f7aee33c2e884e21f31467951a71a7f7935c960721270e67","integrity_receipt_sha256":"57424b6ef65ea1ffe94f98170eee0aa5c884158f85fa92b251bb67a78a749cd3","protocol_sha256":"383c2fe8a0d2baa893bc88326e3a5e18329691a90fd9bd1ea106602c8ee9bf3f","r1_freeze_manifest_sha256":"bedb9df1d6650ab0d4d7f9a255555e4dbe80b07b705b45534eeb290d76fe5fc9","r1_protocol_sha256":"ed113d1c0bfdb44b57c879e2995b610d0ecf528fccedb37fc9b89093be083fbf","sealed_targets_sha256":"e911a70279f5b141c35064da29c020557f69ee17dfed5adad6172ed3fe2db0e0","shortcuts_sha256":"566586fe571a99eadfbc3871eedec3dbf65b049f9f0311a7676f9625e22ac615"},"model":{"architecture":"LlamaForCausalLM","hidden_size":960,"id":"HuggingFaceTB/SmolLM2-360M","license_id":"Apache-2.0","local_locator":"artifacts/models/smollm2-360m-f8027fd0","model_type":"llama","num_hidden_layers":32,"revision":"f8027fd0eaeea54caa13c31d31b9fdc459c38b49"},"output_bundle":{"artifact_hashes":{"dense_sha256":"20a377922b77ac5be0bb212a21d1a7413c33b4dd03cf47c8f98f0c1348388d9f","index_sha256":"baa78647fcc01c1d71cf27ef1c1fd83c6e38feb2a9a54a58fab87f245c63fc58","summary_sha256":"6a15bf58cd336f0a74a082f8b2d2f18c0f29d38af0d56f4d473217881c9f4f13"},"dense_locator":"artifacts/a0r2/a0r2c2-v1.0.0-f8027fd0-r1/activations.json","exact_head":"183cb20654dbdac0d7ad2ce97f184e3286b03a14","hidden_size":960,"records":1920,"reports":["activation-summary.json","representations-index.jsonl","activations.json","activation-receipt.json"]},"protocol_id":"a0r2-independent-model-v1.0.0","runtime":{"device":"cpu","fast_offsets_required":true,"generation":false,"local_files_only":true,"network_access":false,"torch_dtype":"float32"},"scientific_status":"exploratory","status":"pass"}
